{
  "$schema": "../../../schema/pattern.schema.json",
  "schemaVersion": 1,
  "id": "dates",
  "name": "Dates",
  "category": "pattern",
  "group": "ask-users-for",
  "summary": "Help users provide or select a date using an interaction suited to whether the date is memorable, copied from a document, approximate or selected from known options.",
  "source": {
    "guidanceUrl": "https://design-system.service.gov.uk/patterns/dates/",
    "reviewedAt": "2026-09-09"
  },
  "whenToUse": [
    "Use whenever a service asks users to provide or select a date.",
    "Use Date input for memorable dates such as a date of birth or a date copied from a document."
  ],
  "whenNotToUse": [
    "Do not use a calendar picker for dates users know or can copy more easily by typing.",
    "Do not require day-level precision when the service only needs a month, year or approximate date."
  ],
  "rules": [
    "State the expected precision and show a relevant example without pre-filling an answer.",
    "Store and validate the date as separate semantic values or a safe date type, not by assuming the display string is unambiguous.",
    "Use radios or another simple selection control when users choose from a small known set of dates."
  ],
  "accessibility": [
    "Group day, month and year controls with a fieldset, legend and a shared hint.",
    "Report which part of a date is invalid and preserve all values when re-rendering errors."
  ],
  "componentRefs": ["date-input", "fieldset", "radios", "error-message"],
  "relatedPatterns": ["validation"]
}
