{
  "$schema": "../../../schema/pattern.schema.json",
  "schemaVersion": 1,
  "id": "create-accounts",
  "name": "Create accounts",
  "category": "pattern",
  "group": "help-users-to",
  "summary": "Create an account only when users need recurring access to their service data, and defer account creation until it becomes necessary.",
  "source": {
    "guidanceUrl": "https://design-system.service.gov.uk/patterns/create-accounts/",
    "reviewedAt": "2026-09-09"
  },
  "whenToUse": [
    "Use when users need to regularly access, manage or update information held by the service.",
    "Let users complete as much of the journey as possible before requiring the account."
  ],
  "whenNotToUse": [
    "Do not create accounts when a usable one-off service can work without them.",
    "Do not use an account merely to let users check one transaction when a safely delivered reference can meet the need."
  ],
  "rules": [
    "Call the action “Create an account” and clearly separate account creation from sign-in.",
    "Use action labels such as “Create a username” and “Create a password” so users know they are setting new credentials.",
    "Design recovery, email or phone changes, account closure, data retention and fraud controls as part of the journey."
  ],
  "accessibility": [
    "Do not make account recovery depend on one inaccessible channel and allow password managers and paste.",
    "Preserve entered journey data if account creation interrupts an in-progress service."
  ],
  "componentRefs": ["text-input", "password-input", "button", "error-message"],
  "relatedPatterns": ["create-a-username", "passwords", "confirm-an-email-address"]
}
