{
  "$schema": "../../../schema/pattern.schema.json",
  "schemaVersion": 1,
  "id": "page-not-found-pages",
  "name": "Page not found pages",
  "category": "pattern",
  "group": "pages",
  "summary": "Return a clear page when a requested URL does not exist and help users recover without blaming them or exposing technical jargon.",
  "source": {
    "guidanceUrl": "https://design-system.service.gov.uk/patterns/page-not-found-pages/",
    "reviewedAt": "2026-09-09"
  },
  "whenToUse": [
    "Use for a request to a page that does not exist, whether the address was mistyped, copied incorrectly or linked incorrectly.",
    "Return the page with the correct not-found HTTP status while keeping the standard service page structure."
  ],
  "whenNotToUse": [
    "Do not use for an unexpected service failure or planned closure.",
    "Do not redirect every unknown URL to the homepage because that hides the error and removes useful context."
  ],
  "rules": [
    "Use “Page not found” in the page title and as the H1, then suggest checking typed or pasted addresses.",
    "Offer specific contact information only when it meets a user need and fix or redirect known broken service links.",
    "Do not use breadcrumbs, red warning text, humour or jargon such as “404” or “bad request” in the visible content."
  ],
  "accessibility": [
    "Return semantic HTML even when application rendering fails and keep the H1 as the first meaningful content in main.",
    "Ensure recovery and contact links have descriptive destinations and the document title identifies the service."
  ],
  "componentRefs": [],
  "relatedPatterns": ["problem-with-the-service-pages", "service-unavailable-pages", "contact-a-department-or-service-team"]
}
