{
  "$schema": "../../../schema/pattern.schema.json",
  "schemaVersion": 1,
  "id": "passwords",
  "name": "Passwords",
  "category": "pattern",
  "group": "ask-users-for",
  "summary": "Help users create, enter and reset secure, memorable passwords without obstructive restrictions or unsafe recovery journeys.",
  "source": {
    "guidanceUrl": "https://design-system.service.gov.uk/patterns/passwords/",
    "reviewedAt": "2026-09-09"
  },
  "whenToUse": [
    "Use whenever an account requires users to create or enter a password, after confirming an account is necessary.",
    "Choose password rules proportionate to the service’s assessed security needs."
  ],
  "whenNotToUse": [
    "Do not add password authentication when a usable service can be provided without an account.",
    "Do not use extra complexity rules as a substitute for appropriate multi-factor authentication."
  ],
  "rules": [
    "Allow pasting and password managers, set a minimum length of at least 8 characters, set no maximum length and block commonly used passwords.",
    "Explain restrictions consistently wherever users create or enter a password and continue to support existing valid passwords when rules change.",
    "Design reset tokens to be single-use, time-limited and protected; never send or reveal an existing password."
  ],
  "accessibility": [
    "Use the Password input component with correct autocomplete values and a usable show or hide control.",
    "Make requirements available before entry and report each unmet rule without clearing the user’s other form data."
  ],
  "componentRefs": ["password-input", "error-message", "button"],
  "relatedPatterns": ["create-accounts", "confirm-an-email-address", "validation"]
}
