{
  "$schema": "../../../schema/pattern.schema.json",
  "schemaVersion": 1,
  "id": "interruption-pages",
  "name": "Interruption pages",
  "category": "pattern",
  "group": "pages",
  "summary": "Pause a journey only when users must understand unusually important information or confirm a significant consequence before continuing.",
  "source": {
    "guidanceUrl": "https://design-system.service.gov.uk/patterns/interruption-pages/",
    "reviewedAt": "2026-09-09"
  },
  "whenToUse": [
    "Use when the user must notice information that materially changes whether or how they continue.",
    "Use when a potentially surprising answer needs an explicit confirmation before a high-impact action."
  ],
  "whenNotToUse": [
    "Do not interrupt routine journeys for ordinary guidance, marketing, reassurance or information that can appear at the point of need.",
    "Do not use interruption styling as a generic visual emphasis treatment."
  ],
  "rules": [
    "State the issue as the page heading, show the relevant value or consequence and provide one clear primary continuation action.",
    "Offer a plainly worded secondary route to go back or correct the information.",
    "Use the official interruption Panel variant and inverse controls without inventing new colours or urgency levels."
  ],
  "accessibility": [
    "Keep both decisions keyboard accessible with descriptive labels that state their consequences.",
    "Do not rely on the panel colour to communicate importance and do not trap focus or block the browser back action."
  ],
  "componentRefs": ["panel", "button", "back-link"],
  "relatedPatterns": ["question-pages", "exit-a-page-quickly"]
}
