{
  "$schema": "../../../schema/pattern.schema.json",
  "schemaVersion": 1,
  "id": "confirm-a-phone-number",
  "name": "Confirm a phone number",
  "category": "pattern",
  "group": "help-users-to",
  "summary": "Check that a user currently has access to a mobile number by sending a time-limited security code in a text message.",
  "source": {
    "guidanceUrl": "https://design-system.service.gov.uk/patterns/confirm-a-phone-number/",
    "reviewedAt": "2026-09-09"
  },
  "whenToUse": [
    "Use when access to a particular mobile number is necessary for a proportionate service or account security need.",
    "Provide a resend and correction route for delayed messages or an incorrect number."
  ],
  "whenNotToUse": [
    "Do not treat control of a phone number as proof of a person’s identity.",
    "Do not make text-message confirmation the only route when users may not have mobile access or reliable signal."
  ],
  "rules": [
    "Send a short single-use code, set an expiry and limit attempts and resend abuse without locking legitimate users out indefinitely.",
    "Use a type=text field with inputmode=numeric, autocomplete=one-time-code and enough width and letter spacing for the code.",
    "Explain the destination number safely, when the code expires, how to resend it and how to change the number."
  ],
  "accessibility": [
    "Do not split the code into one input per character; one labelled field supports paste and assistive input more reliably.",
    "Announce resend outcomes and errors clearly without starting an inaccessible visual-only countdown."
  ],
  "componentRefs": ["text-input", "button", "error-message", "notification-banner"],
  "relatedPatterns": ["phone-numbers", "validation"]
}
